UserEmail,CommentText,CreationDate,ContentId
HurtScene@gmail.com,Bad thread plane victorious helpful laborer gorgeous ocean.,2022-04-25 23:17:31,655a0db33961f9437c3aa268
PricklyCelery@yahoo.com,Cherry lonely guide sidewalk jello brush angry jeans.,2020-12-10 19:56:51,655a0db33961f9437c3aa268
ProudHydrant@gmail.com,Cloudy drab fuel holiday hobbies cream helpful depressed.,2023-06-14 03:51:38,655a0db33961f9437c3aa268
BewilderedHaircut@gmail.com,Anger odd easy wandering eager brush troubled excited.,2023-09-26 17:56:52,655a0db33961f9437c3aa268
TenderMonth@yahoo.com,Filthy frantic helpful coast embarrassed real face jellyfish.,2020-12-06 06:01:16,655a0db33961f9437c3aa268
GoodMountain@yahoo.com,Temper glamorous envious minister vein sore sparkling ugliest.,2023-06-16 02:31:47,655a0db33961f9437c3aa268
AnnoyingHoney@gmail.com,Elbow wealth attractive hydrant grass lonely scale clever.,2022-10-13 05:38:21,655a0db33961f9437c3aa268
PerfectVoyage@yahoo.com,Funny kitten circle attractive witty pail thrill action.,2021-08-01 09:11:30,655a0db33961f9437c3aa268
ConfusedAppliance@yahoo.com,Railway earthquake depressed cemetery crowded gorgeous enchanting carpenter.,2021-10-29 03:49:45,655a0db33961f9437c3aa268
PreciousRoute@yahoo.com,Gorgeous ill lawyer defiant troubled passenger wandering glamorous.,2021-01-22 02:51:54,655a0db33961f9437c3aa268
EvilPassenger@gmail.com,Upset jeans hobbies bloody depressed guitar dizzy donkey.,2022-09-02 09:18:45,655a0db33961f9437c3aa268
JollyBasketball@yahoo.com,Wrong thoughtful ocean scale brush frantic street fantastic.,2021-03-29 05:12:12,655a0db33961f9437c3aa268
UptightWrench@yahoo.com,Coast bright puzzled beggar pest real beef idea.,2020-09-11 22:21:36,655a0db33961f9437c3aa268
EasyMountain@yahoo.com,Island cherry cherries eggnog filthy holiday wrist joyous.,2023-04-27 20:12:22,655a0db33961f9437c3aa268
CleverHeart@yahoo.com,Stage beef embarrassed goose honey goose basket plain.,2021-09-01 23:03:27,655a0db33961f9437c3aa268
TroubledBoat@yahoo.com,Stormy nutty frail pollution cast locket pail modern.,2023-10-21 15:30:13,655a0db33961f9437c3aa268
8pp8413@gmail.com,Sore boy arithmetic excited wilderness afterthought filthy daughter.,2023-06-13 20:27:03,655a0db33961f9437c3aa268
BewilderedHaircut@gmail.com,Coil feather afterthought laborer beast cemetery cast riddle.,2022-10-29 10:55:47,655a0db33961f9437c3aa268
EnviousArmy@gmail.com,Quicksand breakfast different volleyball inexpensive cobweb magnificent apparel.,2023-01-01 18:45:08,655a0db33961f9437c3aa268
HilariousGhost@yahoo.com,Uptight plane jeans month visitor scene writer fine.,2022-08-16 09:28:53,655a0db33961f9437c3aa268
UnsightlyGate@gmail.com,Evil adorable anxious scarf sleet apparel ugliest beggar.,2022-10-05 11:19:42,655a0db33961f9437c3aa268
UptightWrench@yahoo.com,Squirrel fifth border sore feather fierce graceful mushy.,2021-01-17 18:53:28,655a0db33961f9437c3aa268
WickedOcean@yahoo.com,Bloody zealous precious airport feast basket worrisome frantic.,2021-04-20 09:54:14,655a0db33961f9437c3aa268
GoodMountain@yahoo.com,Depressed evil cable believe green riddle clever drab.,2022-06-02 21:49:11,655a0db33961f9437c3aa268
UptightWrench@yahoo.com,Colorful uptight twig clear caption talented flock uptight.,2022-02-05 09:38:39,655a0db33961f9437c3aa268
FaithfulGalley@gmail.com,Glue cactus important boy patch mountain helpless basket.,2023-10-02 15:21:03,655a0db33961f9437c3aa268
HappyFriction@yahoo.com,Language fair wealth recess mysterious cloudy picture vivacious.,2023-01-08 11:33:00,655a0db33961f9437c3aa268
DizzyBelieve@gmail.com,Cream daughter throne seashore confused joyous activity troubled.,2021-03-16 06:10:14,655a0db33961f9437c3aa268
AnnoyingHoney@gmail.com,Dinner modern believe patch gorgeous wood sheet anger.,2020-11-14 22:15:36,655a0db33961f9437c3aa268
8pp8413@gmail.com,Beginner strange scale wild friction rich poison aftermath.,2023-03-23 18:46:20,655a0db33961f9437c3aa268
CrowdedCent@gmail.com,Faucet month jeans rich lamp bewildered rifle riddle.,2022-01-28 00:56:40,655a0db33961f9437c3aa268
DelightfulCoast@gmail.com,Putrid ghost coach weary popcorn anxious funny lawyer.,2022-06-28 22:57:42,655a0db33961f9437c3aa268
TroubledBoat@yahoo.com,Wicked rifle partner skate defiant feast comfortable breakable.,2022-02-12 20:03:16,655a0db33961f9437c3aa268
UninterestedArmy@gmail.com,Visitor playground awful feast mysterious fine gleaming pollution.,2021-04-06 18:03:46,655a0db33961f9437c3aa268
EasyMountain@yahoo.com,Vacation wild fifth wild dead quilt foolish odd.,2022-01-16 03:29:01,655a0db33961f9437c3aa268
EvilPassenger@gmail.com,Jealous light lawyer kind charming picture goose throne.,2021-06-16 22:59:15,655a0db33961f9437c3aa268
UptightWrench@yahoo.com,Skate reward icicle quilt black turkey uninterested month.,2020-04-15 11:18:45,655a0db33961f9437c3aa268
ThankfulGiraffe@yahoo.com,Uptight fireman carpenter concerned glue talented awful blushing.,2020-05-27 15:15:12,655a0db33961f9437c3aa268
EvilPassenger@gmail.com,Jeans beginner guitar wrist pleasure cooperative motionless hurt.,2021-01-10 05:12:42,655a0db33961f9437c3aa268
ClumsyEducation@yahoo.com,Vegetable nervous money sweater inexpensive zany wrench jolly.,2023-11-11 18:08:29,655a0db33961f9437c3aa268
CrowdedCent@gmail.com,Homeless fancy motionless cobweb advice suit marble stranger.,2020-08-14 04:54:52,655a0db33961f9437c3aa268
