UserEmail,CommentText,CreationDate,ContentId
ProudHydrant@gmail.com,Brave furniture fantastic gorgeous enchanting zealous terrible expensive.,2023-06-08 18:44:13,655a0db33961f9437c3aa269
UnusualStage@yahoo.com,Jittery upset mushy awful joyous creature tired upset.,2021-12-21 13:27:50,655a0db33961f9437c3aa269
HurtScene@gmail.com,Blue upset zany baseball tame tough envious airplane.,2023-07-02 10:47:04,655a0db33961f9437c3aa269
EnviousArmy@gmail.com,Bubble sleepy cherries impossible motionless gate tasty zany.,2022-04-21 18:17:54,655a0db33961f9437c3aa269
HealthyStation@yahoo.com,Afterthought clean weary curious ill successful angry partner.,2022-06-30 19:46:20,655a0db33961f9437c3aa269
RepulsiveScent@yahoo.com,Queen joyous gate tired glove riddle basketball celery.,2022-01-22 17:04:40,655a0db33961f9437c3aa269
MotionlessStage@yahoo.com,Quicksand concerned outstanding jellyfish island vein route scale.,2023-01-08 00:17:33,655a0db33961f9437c3aa269
ThankfulGiraffe@yahoo.com,Lamp laborer wrench ill busy wrist dangerous successful.,2022-09-28 18:46:26,655a0db33961f9437c3aa269
NaughtyMailbox@yahoo.com,Route laborer fancy zealous cherries route easy celery.,2023-03-20 14:23:14,655a0db33961f9437c3aa269
DelightfulCoast@gmail.com,Nutty bubble face ashamed lazy grotesque answer breakable.,2022-03-02 21:00:22,655a0db33961f9437c3aa269
ProudHydrant@gmail.com,Anger health evil patch good afternoon gate dark.,2022-05-18 04:00:39,655a0db33961f9437c3aa269
NaughtyMailbox@yahoo.com,Zany adorable voyage throne route guide finger enthusiastic.,2022-10-30 15:23:05,655a0db33961f9437c3aa269
AnnoyingHoney@gmail.com,Adventurous haircut wrong selfish tame scent holiday guide.,2023-02-23 04:01:45,655a0db33961f9437c3aa269
DizzyBelieve@gmail.com,Cave birthday breakfast station naughty healthy throne quilt.,2023-03-02 05:38:26,655a0db33961f9437c3aa269
HilariousGhost@yahoo.com,Throne drab lazy quaint selfish writer smoke cloth.,2023-05-10 15:01:20,655a0db33961f9437c3aa269
FaithfulGrain@gmail.com,Embarrassed suit cabbage volcano sleepy clever fantastic governor.,2022-04-07 08:21:49,655a0db33961f9437c3aa269
PreciousPlane@gmail.com,Badge ghost attractive activity smiling pleasure zany encouraging.,2022-01-16 00:56:00,655a0db33961f9437c3aa269
LuckyGoose@gmail.com,Horrible faucet handsome scarecrow hot bright glue cruel.,2022-11-16 18:45:08,655a0db33961f9437c3aa269
PuzzledIsland@yahoo.com,Dizzy lucky important anxious mailbox reward brave cheerful.,2023-07-26 09:51:50,655a0db33961f9437c3aa269
RepulsiveScent@yahoo.com,Cent grumpy busy dangerous pleasant fireman distinct geese.,2023-09-22 05:00:56,655a0db33961f9437c3aa269
HealthyStation@yahoo.com,Island fragile cable linen combative cloth stranger impossible.,2022-06-04 12:55:11,655a0db33961f9437c3aa269
TenderMonth@yahoo.com,Smoggy inquisitive vivacious pancake red breakfast dizzy dangerous.,2023-03-15 05:01:58,655a0db33961f9437c3aa269
PerfectVoyage@yahoo.com,Rainstorm squirrel apple drug uninterested wilderness angry education.,2022-10-19 22:18:41,655a0db33961f9437c3aa269
HilariousGhost@yahoo.com,Creepy fair creepy strange enthusiastic action vegetable dangerous.,2023-04-22 07:51:03,655a0db33961f9437c3aa269
ObnoxiousAirport@gmail.com,Cellar panicky playground wealth enchanting fragile scene gentle.,2023-03-26 04:43:19,655a0db33961f9437c3aa269
PreciousRoute@yahoo.com,Strange breakfast temper fifth kitten health brave turkey.,2023-05-24 14:06:08,655a0db33961f9437c3aa269
EvilPassenger@gmail.com,Alert scarf upset rich actor agreeable stormy lawyer.,2022-11-19 20:46:53,655a0db33961f9437c3aa269
GoodMountain@yahoo.com,Crowded galley dangerous riddle cooperative glamorous station handsome.,2022-11-11 19:05:38,655a0db33961f9437c3aa269
ClumsyEducation@yahoo.com,Wrong volcano cattle grass jeans jittery fragile average.,2022-10-02 08:52:31,655a0db33961f9437c3aa269
JoyousButter@yahoo.com,Butter cent wealth airport judge squirrel stranger throat.,2023-07-12 17:04:01,655a0db33961f9437c3aa269
StupidCherries@gmail.com,Face talented anxious bubble lumber sleet condemned thread.,2023-01-26 10:41:38,655a0db33961f9437c3aa269
PricklyCelery@yahoo.com,Successful quilt motionless bubble ugliest breakable dark airport.,2022-05-29 05:02:44,655a0db33961f9437c3aa269
ThankfulGiraffe@yahoo.com,Eggnog airplane hilarious kitten selfish army defeated disgusted.,2022-11-03 04:20:26,655a0db33961f9437c3aa269
LuckyGoose@gmail.com,Awful bushes motionless geese obnoxious funny activity boy.,2023-01-12 18:39:05,655a0db33961f9437c3aa269
GoodMountain@yahoo.com,Lace cooperative crazy mitten quicksand pest scary horrible.,2022-07-17 10:15:44,655a0db33961f9437c3aa269
UnusualStage@yahoo.com,Pest worrisome wild celery boat holiday coast happy.,2022-12-20 06:12:14,655a0db33961f9437c3aa269
GrumpyBucket@gmail.com,Thread bushes sleet outrageous haircut basketball riddle fantastic.,2023-10-05 07:18:46,655a0db33961f9437c3aa269
StupidCherries@gmail.com,Vegetable disgusted pocket underwear vein ghost cellar cemetery.,2023-03-08 11:48:11,655a0db33961f9437c3aa269
JoyousButter@yahoo.com,Cave furniture disgusted itchy arithmetic scene galley treatment.,2023-09-20 09:11:47,655a0db33961f9437c3aa269
AnnoyingHoney@gmail.com,Jello volleyball concerned wren cheerful awful activity scent.,2023-10-03 03:06:39,655a0db33961f9437c3aa269
StupidCherries@gmail.com,Fireman grain nervous texture outstanding healthy unusual odd.,2022-09-06 09:38:56,655a0db33961f9437c3aa269
GloriousHealth@yahoo.com,Cemetery gamer energetic texture black annoying nervous pest.,2022-03-13 22:46:17,655a0db33961f9437c3aa269
GloriousHealth@yahoo.com,Exuberant wandering uninterested uninterested vivacious plane envious beetle.,2022-08-29 13:20:57,655a0db33961f9437c3aa269
ClumsyEducation@yahoo.com,Doubtful cracker lamp cherry cabbage cautious cloth badge.,2023-06-11 23:20:55,655a0db33961f9437c3aa269
EnviousArmy@gmail.com,Cautious number toothbrush stranger important wild uptight toothpaste.,2023-01-26 18:12:30,655a0db33961f9437c3aa269
DelightfulCoast@gmail.com,Unsightly flavor heart ocean donkey rifle island determined.,2022-03-23 18:19:48,655a0db33961f9437c3aa269
TenderMonth@yahoo.com,Education boat charming gentle tasty patch island open.,2022-02-09 05:51:41,655a0db33961f9437c3aa269
WickedOcean@yahoo.com,Pancake obnoxious evil cast filthy hydrant real difficult.,2022-05-09 21:55:11,655a0db33961f9437c3aa269
CrowdedCent@gmail.com,Enchanting lamp twig cream black fair mysterious jittery.,2023-03-11 07:58:30,655a0db33961f9437c3aa269
GloriousHealth@yahoo.com,Beggar excited recess annoyed expensive plane thrill lamp.,2022-02-09 05:05:55,655a0db33961f9437c3aa269
ClumsyEducation@yahoo.com,Vivacious terrible bucket talented bomb face patch marble.,2022-01-03 20:21:39,655a0db33961f9437c3aa269
UninterestedArmy@gmail.com,Weary tender plain light careful amused hobbies gamer.,2022-04-09 01:48:45,655a0db33961f9437c3aa269
HilariousGhost@yahoo.com,Lovely suit cheerful pollution partner upset grieving turkey.,2023-08-09 11:51:57,655a0db33961f9437c3aa269
ConfusedAppliance@yahoo.com,Upset green bad rifle alive plastic disgusted faithful.,2022-05-25 20:09:33,655a0db33961f9437c3aa269
ConfusedAppliance@yahoo.com,Lamp bright elbow confused twig troubled exuberant flavor.,2022-05-20 11:01:10,655a0db33961f9437c3aa269
GrumpyBucket@gmail.com,Defiant nasty poison breakfast calculator thankful foolish demon.,2023-08-07 14:14:08,655a0db33961f9437c3aa269
LuckyGoose@gmail.com,Enthusiastic wicked sleet cute patch beggar face fancy.,2023-08-25 14:41:44,655a0db33961f9437c3aa269
UptightWrench@yahoo.com,Blushing number troubled feast bubble sleet gorgeous colorful.,2023-11-30 13:05:24,655a0db33961f9437c3aa26a
HappyFriction@yahoo.com,Wandering lovely ashamed rifle awful airport thoughtless exuberant.,2023-11-20 11:51:01,655a0db33961f9437c3aa26a
DelightfulCoast@gmail.com,Lawyer activity throne magic geese fifth donkey obnoxious.,2023-11-25 22:05:25,655a0db33961f9437c3aa26a
EasyMountain@yahoo.com,Dead jello volleyball better ghost sweater cute better.,2023-11-27 18:38:40,655a0db33961f9437c3aa26a
GoodMountain@yahoo.com,Stream orange victorious clumsy kitten dead embarrassed cheerful.,2023-11-29 22:44:26,655a0db33961f9437c3aa26a
MotionlessStage@yahoo.com,Beef better cent fancy sweater texture scarf frail.,2023-11-29 18:21:08,655a0db33961f9437c3aa26a
PreciousRoute@yahoo.com,Hurt hydrant magnificent spotless reward obnoxious annoying guitar.,2023-11-29 10:57:17,655a0db33961f9437c3aa26a
kingtut10101@gmail.com,Repulsive vast money jello shy important blue pollution.,2023-11-28 01:13:11,655a0db33961f9437c3aa26a
DelightfulCoast@gmail.com,Baseball honey selfish comfortable wrist language witty beautiful.,2023-11-30 18:42:41,655a0db33961f9437c3aa26a
ThankfulGiraffe@yahoo.com,Tough plane geese outstanding quaint quaint cent itchy.,2023-11-28 23:04:33,655a0db33961f9437c3aa26a
UptightWrench@yahoo.com,Kitten witty cherries jello cannon bright cellar mysterious.,2022-04-17 12:45:08,655a0db33961f9437c3aa268
CleverHeart@yahoo.com,Pollution income worried cruel successful station troubled sparkling.,2023-06-13 01:53:32,655a0db33961f9437c3aa268
JoyousButter@yahoo.com,Lovely pocket cherries helpful squirrel judge thankful scale.,2022-11-26 01:58:34,655a0db33961f9437c3aa268
AmusedFlock@gmail.com,Precious misty successful spotless fine demon temper jealous.,2020-10-27 03:20:06,655a0db33961f9437c3aa268
DizzyBelieve@gmail.com,Long wrench thrill condemned bad impossible joyous elated.,2023-01-23 11:44:35,655a0db33961f9437c3aa268
AnxiousAppliance@gmail.com,Odd feather naughty victorious grotesque seashore wild beetle.,2022-03-21 08:21:39,655a0db33961f9437c3aa268
ThankfulGiraffe@yahoo.com,Holiday obnoxious thread cable channel helpless bushes fragile.,2022-10-28 12:31:59,655a0db33961f9437c3aa268
RepulsiveScent@yahoo.com,Kitten passenger plastic wandering lumber wilderness galley envious.,2020-09-15 07:36:22,655a0db33961f9437c3aa268
AnnoyingHoney@gmail.com,Year faithful airplane ashamed lovely pocket hurt bored.,2023-11-08 22:25:01,655a0db33961f9437c3aa268
WickedOcean@yahoo.com,Doubtful creepy frightened poison linen lucky recess street.,2021-12-31 18:24:58,655a0db33961f9437c3aa268
HomelyScene@gmail.com,Language volleyball glue good tender easy glue scale.,2022-12-02 04:00:02,655a0db33961f9437c3aa268
HurtScene@gmail.com,Exuberant carpenter fair underwear sleet prickly veil wood.,2021-02-24 20:59:45,655a0db33961f9437c3aa268
PuzzledIsland@yahoo.com,Relieved cobweb treatment scale clever hurt victorious creepy.,2021-01-30 18:53:35,655a0db33961f9437c3aa268
ProudHydrant@gmail.com,Rifle wrench badge route island funny crate energetic.,2020-04-08 03:04:25,655a0db33961f9437c3aa268
PreciousRoute@yahoo.com,Easy cream happy voyage perfect sheet red nutty.,2023-01-06 12:59:16,655a0db33961f9437c3aa268
FaithfulGalley@gmail.com,Gentle clean obnoxious oatmeal demon passenger territory faucet.,2023-04-02 05:59:49,655a0db33961f9437c3aa268
ObnoxiousAirport@gmail.com,Plain annoying misty adorable better gorgeous super putrid.,2020-10-01 13:06:17,655a0db33961f9437c3aa268
CrowdedCent@gmail.com,Envious thankful carpenter light patch motionless faithful beautiful.,2022-10-23 11:28:58,655a0db33961f9437c3aa268
PerfectVoyage@yahoo.com,Quicksand thoughtful selfish itchy cracker hair health careful.,2021-09-09 16:51:36,655a0db33961f9437c3aa268
JollyBasketball@yahoo.com,Mitten jealous scary lively glamorous glorious wood police.,2022-06-17 03:54:26,655a0db33961f9437c3aa268
ConfusedAppliance@yahoo.com,Fierce bushes calm spotless curious hilarious vast lumber.,2023-06-19 04:45:39,655a0db33961f9437c3aa268
chrismas@aol.com,Wren modern comfortable cheerful airplane face queen bored.,2020-04-12 08:35:16,655a0db33961f9437c3aa268
AmusedFlock@gmail.com,Puzzled sweater angry cute precious marble cherry haircut.,2022-04-28 08:45:01,655a0db33961f9437c3aa268
TenderMonth@yahoo.com,Airplane underwear vein crowded magnificent hobbies black seashore.,2020-07-18 10:02:19,655a0db33961f9437c3aa268
MotionlessStage@yahoo.com,Toothpaste laborer hobbies poised texture arrogant purple black.,2021-02-20 09:52:05,655a0db33961f9437c3aa268
NaughtyMailbox@yahoo.com,Cannon dinner brain encouraging lamp clear ocean eager.,2020-08-26 20:27:49,655a0db33961f9437c3aa268
NaughtyMailbox@yahoo.com,Curious hurt glorious north frightened famous alive basket.,2020-04-20 23:46:21,655a0db33961f9437c3aa268
ProudHydrant@gmail.com,Bright misty plane stormy giraffe silly bad faucet.,2021-06-30 20:58:49,655a0db33961f9437c3aa268
ThankfulGiraffe@yahoo.com,Oatmeal yellow wrong station poised drab long clean.,2022-12-07 01:04:17,655a0db33961f9437c3aa268
PreciousRoute@yahoo.com,Dangerous station hungry gentle super frame linen mysterious.,2022-06-07 17:40:51,655a0db33961f9437c3aa268
UptightWrench@yahoo.com,Creator fruit homeless cactus writer baseball wealth honey.,2022-05-17 01:25:19,655a0db33961f9437c3aa268
TenderMonth@yahoo.com,Terrible busy nasty calendar arithmetic skate street wood.,2022-08-22 06:42:10,655a0db33961f9437c3aa268
ObnoxiousAirport@gmail.com,North attractive feast skate island throat scary disturbed.,2021-01-25 16:26:58,655a0db33961f9437c3aa268
EasyMountain@yahoo.com,Border grain weary bushes creator north fuel adventurous.,2022-07-05 15:54:54,655a0db33961f9437c3aa268
UnsightlyGate@gmail.com,Brain cloudy handsome temper boat sore famous riddle.,2022-09-15 09:51:20,655a0db33961f9437c3aa268
ProudHydrant@gmail.com,Disturbed action drab wicked gorgeous quilt haircut squirrel.,2022-09-20 13:42:19,655a0db33961f9437c3aa268
8pp8413@gmail.com,Visitor throat income title grotesque thoughtful brainy patch.,2023-11-23 11:24:06,655a0db33961f9437c3aa268
8pp8413@gmail.com,Ladybug toothpaste geese stream wren spotless caption stage.,2023-05-26 12:53:07,655a0db33961f9437c3aa268
UnsightlyGate@gmail.com,Cannon holiday filthy frightened dinner fine treatment gleaming.,2020-10-21 09:26:36,655a0db33961f9437c3aa268
PuzzledIsland@yahoo.com,Faucet joyous doubtful street sweater brainy wild outstanding.,2023-01-08 21:32:04,655a0db33961f9437c3aa268
8pp8413@gmail.com,Flock mailbox obnoxious beggar spotless ashamed sweater uptight.,2023-04-10 15:23:20,655a0db33961f9437c3aa268
ConfusedAppliance@yahoo.com,Toothbrush embarrassed aftermath frail calm cave perfect appliance.,2022-02-09 05:24:49,655a0db33961f9437c3aa268
PreciousPlane@gmail.com,Tame rifle health wandering picture drab clean uptight.,2020-11-06 13:18:04,655a0db33961f9437c3aa268
PerfectVoyage@yahoo.com,Horrible red picture proud marble strange green underwear.,2022-03-15 19:56:59,655a0db33961f9437c3aa268
WickedOcean@yahoo.com,Prickly embarrassed fifth hilarious disturbed money bushes cheerful.,2020-10-15 03:50:00,655a0db33961f9437c3aa268
JoyousButter@yahoo.com,Panicky throne friendly happy calm donkey sleet long.,2023-11-16 04:35:06,655a0db33961f9437c3aa268
chrismas@aol.com,Glorious toothbrush wild zany mysterious pleasant action rifle.,2021-11-04 23:19:09,655a0db33961f9437c3aa268
CrowdedCent@gmail.com,Boy purple rich tense hair inquisitive disturbed beef.,2023-10-14 12:46:59,655a0db33961f9437c3aa268
TenderMonth@yahoo.com,Heart frantic delightful flock year wrist different jealous.,2022-08-13 04:25:00,655a0db33961f9437c3aa268
VictoriousBrain@yahoo.com,Heart clumsy throat bewildered pest butter jittery advice.,2022-02-03 04:41:57,655a0db33961f9437c3aa268
DizzyBelieve@gmail.com,Patch carpenter police picture comfortable cobweb cracker marble.,2022-02-17 21:56:45,655a0db33961f9437c3aa268
JollyBasketball@yahoo.com,Enthusiastic celery fuel horrible volcano beef prickly vegetable.,2022-07-03 15:11:32,655a0db33961f9437c3aa268
UninterestedArmy@gmail.com,Vivacious idea wrist blue galley beginner gamer super.,2022-10-04 10:07:35,655a0db33961f9437c3aa268
PerfectVoyage@yahoo.com,Brainy basket queen famous dead fireman galley delightful.,2023-05-17 07:15:54,655a0db33961f9437c3aa268
EvilPassenger@gmail.com,Evil horrible alert selfish funny fruit kind idea.,2023-11-02 17:42:59,655a0db33961f9437c3aa268
JoyousButter@yahoo.com,Weary hydrant enthusiastic pear toothpaste condemned wilderness throne.,2022-01-04 18:50:35,655a0db33961f9437c3aa268
UninterestedArmy@gmail.com,Drab cannon flavor depressed precious throat helpful smoggy.,2021-01-31 13:43:41,655a0db33961f9437c3aa268
ClumsyEducation@yahoo.com,Careful handsome music panicky faithful attractive yellow acoustics.,2021-02-27 05:23:09,655a0db33961f9437c3aa268
EnviousArmy@gmail.com,Innocent nasty glamorous dinner railway cabbage poised graceful.,2020-12-26 07:31:44,655a0db33961f9437c3aa268
TroubledBoat@yahoo.com,Fancy activity pickle goldfish sparkling pail guide determined.,2021-06-20 17:10:31,655a0db33961f9437c3aa268
DisturbedSheet@gmail.com,Selfish heart cattle disturbed fancy boat cherry money.,2020-05-27 17:25:29,655a0db33961f9437c3aa268
VictoriousBrain@yahoo.com,Tasty lumber clever riddle disgusted victorious brain good.,2023-03-15 03:41:36,655a0db33961f9437c3aa268
UptightWrench@yahoo.com,Concerned nice better smoke oatmeal wrist flock wren.,2022-08-11 17:54:37,655a0db33961f9437c3aa268
TenderMonth@yahoo.com,Seashore vivacious hair wrong tender battle language sidewalk.,2023-09-09 14:38:20,655a0db33961f9437c3aa268
HurtScene@gmail.com,Splendid breakable bubble healthy aftermath squirrel twig picture.,2021-02-25 10:27:40,655a0db33961f9437c3aa268
UptightWrench@yahoo.com,Distinct apparel modern coil plain cute skate pest.,2023-09-23 12:22:26,655a0db33961f9437c3aa268
ThankfulGiraffe@yahoo.com,Acoustics army wrong naughty friction drab joyous homely.,2022-09-22 23:04:56,655a0db33961f9437c3aa268
PerfectVoyage@yahoo.com,Foolish selfish prickly believe jello gorgeous goldfish itchy.,2022-02-17 09:03:55,655a0db33961f9437c3aa268
HealthyStation@yahoo.com,Guide talented tender caption gleaming magnificent handsome wrench.,2020-07-22 22:25:09,655a0db33961f9437c3aa268
ConfusedAppliance@yahoo.com,Afterthought careful stranger squirrel rich coast glove defiant.,2023-04-25 13:22:58,655a0db33961f9437c3aa268
CrowdedCent@gmail.com,Cloudy basketball itchy jeans apparel beetle quaint exuberant.,2022-08-05 01:23:39,655a0db33961f9437c3aa268
GloriousHealth@yahoo.com,Appliance aftermath blue scary victorious wood anger stream.,2020-12-18 06:28:20,655a0db33961f9437c3aa268
VictoriousBrain@yahoo.com,Vivacious colorful quaint actor bucket good vacation birthday.,2020-04-06 22:53:18,655a0db33961f9437c3aa268
JollyBasketball@yahoo.com,Crate nutty minister fancy embarrassed black music lawyer.,2020-08-25 03:15:53,655a0db33961f9437c3aa268
JoyousButter@yahoo.com,Average thread unsightly magic reward beginner cooperative gorgeous.,2021-04-15 12:55:09,655a0db33961f9437c3aa268
RepulsiveScent@yahoo.com,Motionless oatmeal squirrel smoke frail finger route fruit.,2020-07-11 13:37:54,655a0db33961f9437c3aa268
CrowdedCent@gmail.com,Weary passenger turkey jello sugar bad activity friction.,2023-01-21 14:43:13,655a0db33961f9437c3aa268
kingtut10101@gmail.com,Scary jittery ocean magic judge annoying poised unusual.,2023-10-14 17:47:17,655a0db33961f9437c3aa268
GloriousHealth@yahoo.com,Puzzled relieved lovely delightful joyous pollution lettuce route.,2020-07-30 01:43:42,655a0db33961f9437c3aa268
ProudHydrant@gmail.com,Hilarious puzzled bright caption spotless queen faithful nice.,2021-04-26 21:23:57,655a0db33961f9437c3aa268
TroubledBoat@yahoo.com,Hair ladybug fuel afternoon defiant fancy fantastic smiling.,2021-11-13 07:48:50,655a0db33961f9437c3aa268
RepulsiveScent@yahoo.com,Famous unusual adventurous pail eager twig amused stupid.,2023-09-13 21:05:37,655a0db33961f9437c3aa268
CleverHeart@yahoo.com,Thankful splendid bomb vivacious drug smoggy determined purple.,2020-06-04 05:46:36,655a0db33961f9437c3aa268
StupidCherries@gmail.com,Governor friendly modern breakable afternoon finger month agreeable.,2020-08-22 01:46:00,655a0db33961f9437c3aa268
UptightWrench@yahoo.com,Fifth guide obedient gentle relieved honey clever super.,2020-10-02 13:01:57,655a0db33961f9437c3aa268
WickedOcean@yahoo.com,Scent furniture health jittery brainy stranger arithmetic galley.,2023-05-01 08:59:38,655a0db33961f9437c3aa268
HappyFriction@yahoo.com,Blushing light fine precious fierce turkey poison lace.,2023-01-03 15:39:48,655a0db33961f9437c3aa268
HurtScene@gmail.com,Cheerful number shiny hilarious toothbrush drab worrisome texture.,2021-01-13 12:02:58,655a0db33961f9437c3aa268
VictoriousBrain@yahoo.com,Confused fireman cannon scent mitten cactus crowded determined.,2022-07-24 11:04:20,655a0db33961f9437c3aa268
PreciousPlane@gmail.com,Boundary dead baseball drug cave finger important faithful.,2021-12-01 00:24:06,655a0db33961f9437c3aa268
8pp8413@gmail.com,Feast oatmeal hobbies pancake motionless picture cent bored.,2023-02-10 21:50:46,655a0db33961f9437c3aa268
ObnoxiousAirport@gmail.com,Cherry glue helpless clumsy lovely blue open afternoon.,2023-01-16 22:22:54,655a0db33961f9437c3aa268
PricklyCelery@yahoo.com,Worrisome linen obnoxious lonely flock strange panicky charming.,2022-11-03 01:05:38,655a0db33961f9437c3aa268
EasyMountain@yahoo.com,Cabbage geese arithmetic brainy income year heart lawyer.,2021-07-20 23:53:18,655a0db33961f9437c3aa268
HurtScene@gmail.com,Aggressive geese envious funny horrible underwear cast fierce.,2021-08-08 08:39:29,655a0db33961f9437c3aa268
UninterestedArmy@gmail.com,Amused inexpensive uninterested route lively title cabbage elegant.,2020-07-12 00:00:15,655a0db33961f9437c3aa268
EnviousArmy@gmail.com,Inexpensive ill light breakfast visitor activity pear holiday.,2021-10-10 14:01:59,655a0db33961f9437c3aa268
DizzyBelieve@gmail.com,Wild music ugliest baseball cobweb earthquake honey caption.,2021-06-27 16:12:58,655a0db33961f9437c3aa268
HealthyStation@yahoo.com,Prickly minister basketball calculator drab cattle mushy furniture.,2021-03-26 19:09:34,655a0db33961f9437c3aa268
FaithfulGrain@gmail.com,Coach basketball wren celery vein actor pail elegant.,2023-06-28 02:00:56,655a0db33961f9437c3aa268
NaughtyMailbox@yahoo.com,Coast beginner action ocean month annoyed lawyer cannon.,2020-09-09 04:52:23,655a0db33961f9437c3aa268
EnviousArmy@gmail.com,Talented nervous fantastic defeated toothpaste sheet quilt goose.,2020-09-03 03:10:51,655a0db33961f9437c3aa268
EvilPassenger@gmail.com,Linen upset strange sidewalk outstanding better magic adorable.,2023-03-29 12:07:12,655a0db33961f9437c3aa268
HealthyStation@yahoo.com,Frantic clumsy agreeable obedient tired icicle locket black.,2023-10-03 02:08:33,655a0db33961f9437c3aa268
DisturbedSheet@gmail.com,Pail determined earthquake creature cactus shy oatmeal victorious.,2020-03-28 17:40:59,655a0db33961f9437c3aa268
PreciousRoute@yahoo.com,Basket lawyer curious beast muddy flock vein amused.,2022-07-15 19:45:28,655a0db33961f9437c3aa268
TenderMonth@yahoo.com,Uninterested magnificent volleyball guide channel sidewalk yellow grumpy.,2020-09-14 22:32:24,655a0db33961f9437c3aa268
ConfusedAppliance@yahoo.com,Blue voyage airport donkey stranger tough afterthought stream.,2022-05-15 06:39:46,655a0db33961f9437c3aa268
HomelyScene@gmail.com,Average nice fifth rainstorm proud clear kitten disturbed.,2020-07-22 22:03:07,655a0db33961f9437c3aa268
GloriousHealth@yahoo.com,Graceful adorable celery passenger gentle dinner activity bloody.,2022-03-20 02:11:44,655a0db33961f9437c3aa268
JoyousButter@yahoo.com,Weary scene misty anger throne eggnog condemned seashore.,2021-04-24 13:28:55,655a0db33961f9437c3aa268
HappyFriction@yahoo.com,Squirrel vivacious lonely super brush spotless island crazy.,2021-02-13 12:52:30,655a0db33961f9437c3aa268
DizzyBelieve@gmail.com,Charming real blue pest nervous throne battle plain.,2022-03-25 02:03:36,655a0db33961f9437c3aa268
PerfectVoyage@yahoo.com,Skate defiant eggnog number lettuce comfortable vivacious alert.,2023-01-25 05:12:40,655a0db33961f9437c3aa268
MotionlessStage@yahoo.com,Grumpy quicksand cast plane breakable afternoon fancy sweater.,2022-10-16 20:56:47,655a0db33961f9437c3aa268
RepulsiveScent@yahoo.com,Shiny poison army weather street vein mailbox important.,2020-12-20 07:32:47,655a0db33961f9437c3aa268
HappyFriction@yahoo.com,Badge vegetable believe dizzy popcorn caption action handsome.,2022-01-05 14:35:27,655a0db33961f9437c3aa268
CleverHeart@yahoo.com,Cooperative apple depressed poison scent rifle sleepy poised.,2023-06-20 14:11:55,655a0db33961f9437c3aa268
UnusualStage@yahoo.com,Lovely ladybug boat brave tame jittery inquisitive afternoon.,2020-12-22 06:19:29,655a0db33961f9437c3aa268
PreciousRoute@yahoo.com,Kitten fair comfortable beautiful hilarious nasty poor apparel.,2021-08-06 15:04:32,655a0db33961f9437c3aa268
GoodMountain@yahoo.com,Outstanding route skate flavor adorable feather pleasant thoughtless.,2022-06-20 20:20:40,655a0db33961f9437c3aa268
DizzyBelieve@gmail.com,Coil actor feast glorious lazy goldfish veil actor.,2020-09-22 22:52:23,655a0db33961f9437c3aa268
GloriousHealth@yahoo.com,Alive route arithmetic pail cast island battle police.,2020-06-07 06:45:28,655a0db33961f9437c3aa268
PricklyCelery@yahoo.com,Mysterious real plastic sidewalk elegant grotesque afternoon wandering.,2021-05-15 23:51:32,655a0db33961f9437c3aa268
ObnoxiousAirport@gmail.com,Seashore stage daughter graceful powerful lamp activity shiny.,2020-07-09 12:33:17,655a0db33961f9437c3aa268
chrismas@aol.com,Island territory cave creature wren calculator airplane pleasant.,2020-11-09 19:32:59,655a0db33961f9437c3aa268
HealthyStation@yahoo.com,Important worrisome education agreeable toothbrush exuberant colorful hydrant.,2020-09-23 00:32:30,655a0db33961f9437c3aa268
GloriousHealth@yahoo.com,Tasty annoying grain ugliest calendar obedient sparkling cellar.,2021-08-04 23:21:03,655a0db33961f9437c3aa268
ThankfulGiraffe@yahoo.com,Fireman island magnificent graceful gamer aggressive cent reward.,2022-10-09 13:22:12,655a0db33961f9437c3aa268
StupidCherries@gmail.com,Money real scary crate horrible weary grumpy appliance.,2023-05-02 10:54:34,655a0db33961f9437c3aa268
